smartctl 7.1 2019-12-30 r5022 [x86_64-linux-5.4.78-2-pve] (local build)
Copyright (C) 2002-19, Bruce Allen, Christian Franke, www.smartmontools.org

=== START OF INFORMATION SECTION ===
Model Family:     Crucial/Micron BX/MX1/2/3/500, M5/600, 1100 SSDs
Device Model:     CT120BX500SSD1
Serial Number:    1836E154C437
LU WWN Device Id: 0 000000 000000000
Firmware Version: M6CR013
User Capacity:    120,034,123,776 bytes [120 GB]
Sector Size:      512 bytes logical/physical
Rotation Rate:    Solid State Device
Form Factor:      2.5 inches
Device is:        In smartctl database [for details use: -P show]
ATA Version is:   ACS-2 T13/2015-D revision 3
SATA Version is:  SATA 3.2, 6.0 Gb/s (current: 6.0 Gb/s)
Local Time is:    Mon Mar 29 13:10:19 2021 CEST
SMART support is: Available - device has SMART capability.
SMART support is: Enabled

=== START OF READ SMART DATA SECTION ===
SMART overall-health self-assessment test result: PASSED
See vendor-specific Attribute list for marginal Attributes.

General SMART Values:
Offline data collection status:  (0x00)	Offline data collection activity
					was never started.
					Auto Offline Data Collection: Disabled.
Self-test execution status:      (   0)	The previous self-test routine completed
					without error or no self-test has ever 
					been run.
Total time to complete Offline 
data collection: 		(  120) seconds.
Offline data collection
capabilities: 			 (0x11) SMART execute Offline immediate.
					No Auto Offline data collection support.
					Suspend Offline collection upon new
					command.
					No Offline surface scan supported.
					Self-test supported.
					No Conveyance Self-test supported.
					No Selective Self-test supported.
SMART capabilities:            (0x0002)	Does not save SMART data before
					entering power-saving mode.
					Supports SMART auto save timer.
Error logging capability:        (0x01)	Error logging supported.
					General Purpose Logging supported.
Short self-test routine 
recommended polling time: 	 (   2) minutes.
Extended self-test routine
recommended polling time: 	 (  10) minutes.

SMART Attributes Data Structure revision number: 1
Vendor Specific SMART Attributes with Thresholds:
ID# ATTRIBUTE_NAME          FLAG     VALUE WORST THRESH TYPE      UPDATED  WHEN_FAILED RAW_VALUE
  1 Raw_Read_Error_Rate     0x002f   100   100   050    Pre-fail  Always       -       0
  5 Reallocate_NAND_Blk_Cnt 0x0032   100   100   010    Old_age   Always       -       0
  9 Power_On_Hours          0x0032   100   100   050    Old_age   Always       -       4873
 12 Power_Cycle_Count       0x0032   100   100   050    Old_age   Always       -       466
171 Program_Fail_Count      0x0032   100   100   050    Old_age   Always       -       0
172 Erase_Fail_Count        0x0032   100   100   050    Old_age   Always       -       0
173 Ave_Block-Erase_Count   0x0032   100   100   050    Old_age   Always       -       203
174 Unexpect_Power_Loss_Ct  0x0032   100   100   050    Old_age   Always       -       282
180 Unused_Reserve_NAND_Blk 0x0032   100   100   050    Old_age   Always       -       100
183 SATA_Interfac_Downshift 0x0032   100   100   050    Old_age   Always       -       0
184 Error_Correction_Count  0x0032   100   100   050    Old_age   Always       -       0
187 Reported_Uncorrect      0x0032   100   100   050    Old_age   Always       -       0
194 Temperature_Celsius     0x0022   061   022   050    Old_age   Always   In_the_past 39 (Min/Max 28/78)
196 Reallocated_Event_Count 0x0032   100   100   050    Old_age   Always       -       0
197 Current_Pending_Sector  0x0032   100   100   050    Old_age   Always       -       0
198 Offline_Uncorrectable   0x0030   100   100   050    Old_age   Offline      -       0
199 UDMA_CRC_Error_Count    0x0032   100   100   050    Old_age   Always       -       1
202 Percent_Lifetime_Remain 0x0030   087   087   001    Old_age   Offline      -       87
206 Write_Error_Rate        0x002e   100   100   050    Old_age   Always       -       0
210 Success_RAIN_Recov_Cnt  0x0032   100   100   050    Old_age   Always       -       0
246 Total_LBAs_Written      0x0032   100   100   050    Old_age   Always       -       16273569440
247 Host_Program_Page_Count 0x0032   100   100   050    Old_age   Always       -       508549045
248 FTL_Program_Page_Count  0x0032   100   100   050    Old_age   Always       -       666154704

SMART Error Log Version: 1
Warning: ATA error count 0 inconsistent with error log pointer 1

ATA Error Count: 0
	CR = Command Register [HEX]
	FR = Features Register [HEX]
	SC = Sector Count Register [HEX]
	SN = Sector Number Register [HEX]
	CL = Cylinder Low Register [HEX]
	CH = Cylinder High Register [HEX]
	DH = Device/Head Register [HEX]
	DC = Device Command Register [HEX]
	ER = Error register [HEX]
	ST = Status register [HEX]
Powered_Up_Time is measured from power on, and printed as
DDd+hh:mm:SS.sss where DD=days, hh=hours, mm=minutes,
SS=sec, and sss=millisec. It "wraps" after 49.710 days.

Error -4 occurred at disk power-on lifetime: 0 hours (0 days + 0 hours)
  When the command that caused the error occurred, the device was active or idle.

  After command completion occurred, registers were:
  ER ST SC SN CL CH DH
  -- -- -- -- -- -- --
  00 00 00 00 00 00 00   at LBA = 0x00000000 = 0

  Commands leading to the command that caused the error were:
  CR FR SC SN CL CH DH DC   Powered_Up_Time  Command/Feature_Name
  -- -- -- -- -- -- -- --  ----------------  --------------------
  61 08 e0 f0 48 ae 00 00      00:00:00.000  WRITE FPDMA QUEUED
  61 20 18 20 49 ae 00 00      00:00:00.000  WRITE FPDMA QUEUED
  61 08 70 88 77 97 00 00      00:00:00.000  WRITE FPDMA QUEUED
  61 20 18 20 49 ae 00 00      00:00:00.000  WRITE FPDMA QUEUED
  61 20 18 20 49 ae 00 00      00:00:00.000  WRITE FPDMA QUEUED

SMART Self-test log structure revision number 1
No self-tests have been logged.  [To run self-tests, use: smartctl -t]

Selective Self-tests/Logging not supported

