smartctl 7.1 2019-12-30 r5022 [x86_64-linux-5.4.78-2-pve] (local build)
Copyright (C) 2002-19, Bruce Allen, Christian Franke, www.smartmontools.org

=== START OF INFORMATION SECTION ===
Model Family:     Phison Driven OEM SSDs
Device Model:     INTENSO SATA III SSD
Serial Number:    A472078B013000438734
LU WWN Device Id: 0 000000 000000000
Firmware Version: SBFM61.2
User Capacity:    240,057,409,536 bytes [240 GB]
Sector Size:      512 bytes logical/physical
Rotation Rate:    Solid State Device
Form Factor:      2.5 inches
Device is:        In smartctl database [for details use: -P show]
ATA Version is:   ACS-4 (minor revision not indicated)
SATA Version is:  SATA 3.2, 6.0 Gb/s (current: 6.0 Gb/s)
Local Time is:    Sat Apr  3 02:00:02 2021 CEST
SMART support is: Available - device has SMART capability.
SMART support is: Enabled

=== START OF READ SMART DATA SECTION ===
SMART overall-health self-assessment test result: PASSED

General SMART Values:
Offline data collection status:  (0x00)	Offline data collection activity
					was never started.
					Auto Offline Data Collection: Disabled.
Self-test execution status:      (   0)	The previous self-test routine completed
					without error or no self-test has ever 
					been run.
Total time to complete Offline 
data collection: 		(65535) seconds.
Offline data collection
capabilities: 			 (0x79) SMART execute Offline immediate.
					No Auto Offline data collection support.
					Suspend Offline collection upon new
					command.
					Offline surface scan supported.
					Self-test supported.
					Conveyance Self-test supported.
					Selective Self-test supported.
SMART capabilities:            (0x0003)	Saves SMART data before entering
					power-saving mode.
					Supports SMART auto save timer.
Error logging capability:        (0x01)	Error logging supported.
					General Purpose Logging supported.
Short self-test routine 
recommended polling time: 	 (   2) minutes.
Extended self-test routine
recommended polling time: 	 (  30) minutes.
Conveyance self-test routine
recommended polling time: 	 (   6) minutes.

SMART Attributes Data Structure revision number: 16
Vendor Specific SMART Attributes with Thresholds:
ID# ATTRIBUTE_NAME          FLAG     VALUE WORST THRESH TYPE      UPDATED  WHEN_FAILED RAW_VALUE
  1 Raw_Read_Error_Rate     0x000b   100   100   050    Pre-fail  Always       -       0
  9 Power_On_Hours          0x0012   100   100   000    Old_age   Always       -       16593
 12 Power_Cycle_Count       0x0012   100   100   000    Old_age   Always       -       506
168 SATA_Phy_Error_Count    0x0012   100   100   000    Old_age   Always       -       0
170 Bad_Blk_Ct_Erl/Lat      0x0003   048   048   010    Pre-fail  Always       -       0/1038
173 MaxAvgErase_Ct          0x0012   100   100   000    Old_age   Always       -       115 (Average 69)
192 Unsafe_Shutdown_Count   0x0012   100   100   000    Old_age   Always       -       121
194 Temperature_Celsius     0x0023   067   067   000    Pre-fail  Always       -       33 (Min/Max 33/33)
196 Not_In_Use              0x0012   100   100   000    Old_age   Always       -       82105554067
218 CRC_Error_Count         0x000b   100   100   050    Pre-fail  Always       -       2
231 SSD_Life_Left           0x0013   100   100   000    Pre-fail  Always       -       97
241 Lifetime_Writes_GiB     0x0012   100   100   000    Old_age   Always       -       14852

SMART Error Log Version: 1
No Errors Logged

SMART Self-test log structure revision number 1
No self-tests have been logged.  [To run self-tests, use: smartctl -t]

SMART Selective self-test log data structure revision number 0
Note: revision number not 1 implies that no selective self-test has ever been run
 SPAN  MIN_LBA  MAX_LBA  CURRENT_TEST_STATUS
    1        0        0  Not_testing
    2        0        0  Not_testing
    3        0        0  Not_testing
    4        0        0  Not_testing
    5        0        0  Not_testing
Selective self-test flags (0x0):
  After scanning selected spans, do NOT read-scan remainder of disk.
If Selective self-test is pending on power-up, resume after 0 minute delay.

