smartctl 7.1 2019-12-30 r5022 [x86_64-linux-5.4.78-2-pve] (local build)
Copyright (C) 2002-19, Bruce Allen, Christian Franke, www.smartmontools.org

=== START OF INFORMATION SECTION ===
Model Family:     Phison Driven SSDs
Device Model:     KINGSTON SA400S37120G
Serial Number:    50026B778205F4E2
LU WWN Device Id: 5 0026b7 78205f4e2
Firmware Version: SBFK71E0
User Capacity:    120,034,123,776 bytes [120 GB]
Sector Size:      512 bytes logical/physical
Rotation Rate:    Solid State Device
Form Factor:      2.5 inches
Device is:        In smartctl database [for details use: -P show]
ATA Version is:   ACS-4 (minor revision not indicated)
SATA Version is:  SATA 3.2, 6.0 Gb/s (current: 6.0 Gb/s)
Local Time is:    Sun Mar 28 05:37:48 2021 CEST
SMART support is: Available - device has SMART capability.
SMART support is: Enabled

=== START OF READ SMART DATA SECTION ===
SMART overall-health self-assessment test result: PASSED

General SMART Values:
Offline data collection status:  (0x00)	Offline data collection activity
					was never started.
					Auto Offline Data Collection: Disabled.
Self-test execution status:      (   0)	The previous self-test routine completed
					without error or no self-test has ever 
					been run.
Total time to complete Offline 
data collection: 		(65535) seconds.
Offline data collection
capabilities: 			 (0x79) SMART execute Offline immediate.
					No Auto Offline data collection support.
					Suspend Offline collection upon new
					command.
					Offline surface scan supported.
					Self-test supported.
					Conveyance Self-test supported.
					Selective Self-test supported.
SMART capabilities:            (0x0003)	Saves SMART data before entering
					power-saving mode.
					Supports SMART auto save timer.
Error logging capability:        (0x01)	Error logging supported.
					General Purpose Logging supported.
Short self-test routine 
recommended polling time: 	 (   2) minutes.
Extended self-test routine
recommended polling time: 	 (  30) minutes.
Conveyance self-test routine
recommended polling time: 	 (   6) minutes.

SMART Attributes Data Structure revision number: 16
Vendor Specific SMART Attributes with Thresholds:
ID# ATTRIBUTE_NAME          FLAG     VALUE WORST THRESH TYPE      UPDATED  WHEN_FAILED RAW_VALUE
  1 Raw_Read_Error_Rate     0x0032   000   100   000    Old_age   Always       -       0
  9 Power_On_Hours          0x0032   100   100   000    Old_age   Always       -       18796
 12 Power_Cycle_Count       0x0032   100   100   000    Old_age   Always       -       740
148 Unknown_Attribute       0x0000   100   100   000    Old_age   Offline      -       0
149 Unknown_Attribute       0x0000   100   100   000    Old_age   Offline      -       0
167 Write_Protect_Mode      0x0000   100   100   000    Old_age   Offline      -       0
168 SATA_Phy_Error_Count    0x0012   100   100   000    Old_age   Always       -       0
169 Bad_Block_Rate          0x0000   100   100   000    Old_age   Offline      -       7
170 Bad_Blk_Ct_Erl/Lat      0x0000   100   100   000    Old_age   Offline      -       0/8
172 Erase_Fail_Count        0x0032   100   100   000    Old_age   Always       -       0
173 MaxAvgErase_Ct          0x0000   100   100   000    Old_age   Offline      -       314 (Average 266)
181 Program_Fail_Count      0x0032   100   100   000    Old_age   Always       -       0
182 Erase_Fail_Count        0x0000   100   100   000    Old_age   Offline      -       0
187 Reported_Uncorrect      0x0032   100   100   000    Old_age   Always       -       0
192 Unsafe_Shutdown_Count   0x0012   100   100   000    Old_age   Always       -       118
194 Temperature_Celsius     0x0022   073   055   000    Old_age   Always       -       27 (Min/Max 16/45)
196 Reallocated_Event_Count 0x0032   100   100   000    Old_age   Always       -       0
199 SATA_CRC_Error_Count    0x0032   100   100   000    Old_age   Always       -       0
218 CRC_Error_Count         0x0032   100   100   000    Old_age   Always       -       0
231 SSD_Life_Left           0x0000   027   027   000    Old_age   Offline      -       73
233 Flash_Writes_GiB        0x0032   100   100   000    Old_age   Always       -       25470
241 Lifetime_Writes_GiB     0x0032   100   100   000    Old_age   Always       -       20648
242 Lifetime_Reads_GiB      0x0032   100   100   000    Old_age   Always       -       40403
244 Average_Erase_Count     0x0000   100   100   000    Old_age   Offline      -       266
245 Max_Erase_Count         0x0000   100   100   000    Old_age   Offline      -       314
246 Total_Erase_Count       0x0000   100   100   000    Old_age   Offline      -       1568532

SMART Error Log Version: 1
No Errors Logged

SMART Self-test log structure revision number 1
Num  Test_Description    Status                  Remaining  LifeTime(hours)  LBA_of_first_error
# 1  Short offline       Completed without error       00%       442         -

SMART Selective self-test log data structure revision number 0
Note: revision number not 1 implies that no selective self-test has ever been run
 SPAN  MIN_LBA  MAX_LBA  CURRENT_TEST_STATUS
    1        0        0  Not_testing
    2        0        0  Not_testing
    3        0        0  Not_testing
    4        0        0  Not_testing
    5        0        0  Not_testing
Selective self-test flags (0x0):
  After scanning selected spans, do NOT read-scan remainder of disk.
If Selective self-test is pending on power-up, resume after 0 minute delay.

